question,gemini_answer
Calculate the average account balance for customers in the 'AFRICA' region.,`regions.WHERE(name=='AFRICA').nations.customers.CALCULATE(avg_bal=AVG(acctbal))` This assumes calculation context. A better way: `customers.WHERE(nation.region.name == 'AFRICA').CALCULATE(avg_bal=AVG(acctbal))` (But this gives one value). To get the single value: `GRAPH.CALCULATE(avg_african_bal=AVG(customers.WHERE(nation.region.name == 'AFRICA').acctbal))`
Find the minimum order date among all orders.,`GRAPH.CALCULATE(min_order_date=MIN(orders.order_date))`
Find the maximum price (`retail_price`) among all parts.,`GRAPH.CALCULATE(max_retail_price=MAX(parts.retail_price))`
Select the `part_key` and `name` for parts whose name contains the word 'tin' (case-insensitive).,`parts.CALCULATE(part_key=key, name=name).WHERE(CONTAINS(LOWER(name), 'tin'))`
Select the `supplier_key` and `name` for suppliers whose name ends with 'Ltd.'.,`suppliers.CALCULATE(supplier_key=key, name=name).WHERE(ENDSWITH(name, 'Ltd.'))`
Get the length of the comment for each region.,`regions.CALCULATE(region_name=name, comment_length=LENGTH(comment))`
Generate a derived field `order_priority_level` which is 'HIGH' if `order_priority` starts with '1', 'MEDIUM' if it starts with '2', and 'LOW' otherwise.,`orders.CALCULATE(order_priority_level = IFF(STARTSWITH(order_priority, '1'), 'HIGH', IFF(STARTSWITH(order_priority, '2'), 'MEDIUM', 'LOW')))`
Check if any nation has a comment longer than 150 characters.,`GRAPH.CALCULATE(long_comment_exists = HAS(nations.WHERE(LENGTH(comment)>150)) == 1)` Note: `HAS` operates on collections.
Calculate the absolute difference between `supply_cost` and `retail_price` for each part.,`parts.CALCULATE(price_diff = ABS(supply_cost - retail_price))`
For each year/priority combination, calculate its percentage of total orders for that year, then find the priority with the highest percentage for each year.,`order_info = orders.CALCULATE(year=YEAR(order_date), priority=order_priority); year_priority_counts = order_info.PARTITION(name="yp", by=(year, priority)).CALCULATE(year=year, priority=priority, n_orders=COUNT(orders)); year_priority_percentages = year_priority_counts.PARTITION(name="year_group", by=year).yp.CALCULATE(year=year, highest_priority=priority, priority_pct=100.0 * n_orders / RELSUM(n_orders, per="year_group")).WHERE(RANKING(by=priority_pct.DESC(), per="year_group") == 1).ORDER_BY(year.ASC())`
Group `DailyPrices` by ticker symbol and month. Calculate avg closing, max high, and min low price for each group.,`price_info = DailyPrices.CALCULATE(month=JOIN_STRINGS("-", YEAR(date), LPAD(MONTH(date), 2, "0")), symbol=ticker.symbol); ticker_months = price_info.PARTITION(name="months", by=(symbol, month)); month_stats = ticker_months.CALCULATE(symbol=symbol, month=month, avg_close=AVG(DailyPrices.close), max_high=MAX(DailyPrices.high), min_low=MIN(DailyPrices.low)); result = month_stats.CALCULATE(symbol, month, avg_close, max_high, min_low)` Note: Accessing DailyPrices within Calculate after Partition requires care. Correct approach might be: `month_stats = ticker_months.CALCULATE(symbol=symbol, month=month, avg_close=AVG(months.DailyPrices.close), max_high=MAX(months.DailyPrices.high), min_low=MIN(months.DailyPrices.low))` Check context rules carefully. The provided example seems okay.
Count how many part sizes have an above-average number of unique combinations of (part type, container).,`combo_groups = Parts.PARTITION(name="groups", by=(size, type, container)); size_groups = combo_groups.PARTITION(name="sizes", by=size).CALCULATE(size=size, n_combos=COUNT(groups)); GRAPH.CALCULATE(avg_n_combo=AVG(size_groups.n_combos)).size_groups.WHERE(n_combos > avg_n_combo).CALCULATE(count_above_avg = COUNT(size))` Note: Final calculation simplified to get the count.
Identify transactions below the average share count for their (customer, stock, type), AND below avg for (customer, stock), AND below avg for (customer).,`ctt_groups = Transactions.PARTITION(name="ctt", by=(customer_id, ticker_id, transaction_type)).CALCULATE(cus_tick_typ_avg_shares=AVG(Transactions.shares)); ct_groups = ctt_groups.PARTITION(name="ct", by=(customer_id, ticker_id)).CALCULATE(cust_tick_avg_shares=AVG(ctt.Transactions.shares)); c_groups = ct_groups.PARTITION(name="c", by=customer_id).CALCULATE(cust_avg_shares=AVG(ct.ctt.Transactions.shares)); c_groups.ct.ctt.Transactions.WHERE((shares < cus_tick_typ_avg_shares) & (shares < cust_tick_avg_shares) & (shares < cust_avg_shares)).CALCULATE(transaction_id, customer.name, ticker.symbol, transaction_type, shares, cus_tick_typ_avg_shares, cust_tick_avg_shares, cust_avg_shares).ORDER_BY(transaction_id.ASC())`
What general principle should guide writing complex PyDough queries regarding hierarchy and composition?,Combine filters, transformations, and aggregations hierarchically at the appropriate level. Avoid unnecessary intermediate steps or partitioning. Leverage `CALCULATE` for direct aggregations and `WHERE` for filtering at the correct scope.
If a query asks for the total value for "each year" without specifying which years, what must the PyDough code do?,It must calculate the value for each year present in the data (1995, 1996, 1997, 1998) and likely use `SINGULAR` to present each year's result distinctly.
Can you use `nation.name` directly in the `by` clause of a `PARTITION` on the `customers` collection?,Yes, if `nation.name` is a singular, scalar field accessible from `customers`. `by=(nation.name)` would be valid. *Correction based on examples*: It's better/required to calculate first: `customers.CALCULATE(nation_name=nation.name).PARTITION(by=nation_name)`.
Find the number of orders for every nation that has customers with orders.,`nations.WHERE(HAS(customers.orders)==1).CALCULATE(nation_name=name, num_of_orders=COUNT(customers.orders))`
Select the first name and last name of all people.,`People.CALCULATE(first_name=first_name, last_name=last_name)`
Calculate the cost per unit for packages (`package_cost / quantity`).,`Packages.CALCULATE(cost_per_unit=package_cost / quantity)`
Find addresses that do *not* have any current occupants.,`Addresses.WHERE(HASNOT(current_occupants)==1)`
Get the top 3 suppliers based on the sum of their line item extended prices (descending).,`suppliers.WHERE(HAS(lines)==1).CALCULATE(supplier_name=name, total_sales=SUM(lines.extended_price)).TOP_K(3, by=total_sales.DESC())` *Self-correction*: `TOP_K` needs expression, calculation must be separate or integrated if possible. Better: `suppliers.TOP_K(3, by=SUM(lines.extended_price).DESC()).CALCULATE(supplier_name=name, total_sales=SUM(lines.extended_price))` (Requires check if `total_sales` can be recalculated or needs pre-calculation). Let's try the example style: `suppliers.CALCULATE(supplier_name=name, total_sales=SUM(lines.extended_price)).TOP_K(3, by=total_sales.DESC())` This assumes total_sales is available for TOP_K. The rule "TOP_K ... must ALWAYS provide an expression" suggests `by=SUM(lines.extended_price).DESC()` is the correct part for `TOP_K`. The example `customers.CALCULATE(cust_name=name).TOP_K(10, by=COUNT(orders).DESC())` shows pre-calculation of selected fields, then TOP_K. Final Answer: `suppliers.CALCULATE(supplier_name=name).TOP_K(3, by=SUM(lines.extended_price).DESC())`
Group packages by the year and month of their `order_date`.,`package_info = Packages.CALCULATE(order_year=YEAR(order_date), order_month=MONTH(order_date)); package_info.PARTITION(name='packs', by=(order_year, order_month))`
For each year/month group of packages, find packages with a cost below the average cost for that specific year/month.,`package_info = Packages.CALCULATE(order_year=YEAR(order_date), order_month=MONTH(order_date)); package_info.PARTITION(name="months", by=(order_year, order_month)).CALCULATE(order_year, order_month, avg_package_cost=AVG(Packages.package_cost)).Packages.WHERE(package_cost < avg_package_cost)`
For each city/state, calculate the percentage of total packages (ordered by occupants of that city/state) that each occupant ordered.,`Addresses.WHERE(HAS(current_occupants.packages)==1).PARTITION(name="cities", by=(city, state)).CALCULATE(city=city, state=state, total_packages=COUNT(Addresses.current_occupants.packages)).Addresses.current_occupants.CALCULATE(first_name, last_name, city=city, state=state, pct_of_packages=100.0 * COUNT(packages) / total_packages)` Note slight adjustment needed based on example structure, ensuring city/state are available. Corrected: `Addresses.WHERE(HAS(current_occupants.packages)==1).PARTITION(name="cities", by=(city, state)).CALCULATE(total_packages=COUNT(Addresses.current_occupants.packages)).Addresses.CALCULATE(city=city, state=state).current_occupants.CALCULATE(first_name, last_name, city=city, state=state, pct_of_packages=100.0 * COUNT(packages) / total_packages)`
Rank every customer globally by their account balance (descending).,`customers.CALCULATE(rank=RANKING(by=acctbal.DESC()))`
Rank every customer by their account balance (descending) relative to other customers in the same Region.,`Regions.nations.customers.CALCULATE(rank=RANKING(by=acctbal.DESC(), per="Regions"))`
Calculate the ratio between each customer's account balance and the global sum of all customer account balances.,`Customers.CALCULATE(ratio=acctbal / RELSUM(acctbal))`
Find all customers whose account balance is above the global average customer account balance.,`Customers.WHERE(acctbal > RELAVG(acctbal))`
Calculate, for each order, the number of days since January 1st, 1992.,`Orders.CALCULATE(days_since=DATEDIFF("days", DATETIME('1992-01-01'), order_date))` Note: Date construction syntax might vary, assume standard ISO date works. Cheat sheet example uses `datetime.date(1992, 1, 1)`. Use that: `Orders.CALCULATE(days_since=DATEDIFF("days", datetime.date(1992, 1, 1), order_date))`
Truncate each order's `order_date` to the first day of its year.,`Orders.CALCULATE(order_year_start=DATETIME(order_date, 'START OF Y'))`
Find customers whose nation's name is either 'CANADA' or 'USA'.,`customers.WHERE(ISIN(nation.name, ('CANADA', 'USA')))`
Create a field `discount_category` for line items: 'High' if discount > 0.07, 'Low' if discount < 0.03, 'Mid' otherwise.,`lineitems.CALCULATE(discount_category = IFF(discount > 0.07, 'High', IFF(discount < 0.03, 'Low', 'Mid')))`
Get the name of the region for each supplier.,`suppliers.CALCULATE(supplier_name=name, region_name=nation.region.name)`
Count the number of suppliers in each region.,`regions.CALCULATE(region_name=name, supplier_count=COUNT(nations.suppliers))`
Find the supplier with the highest account balance.,`suppliers.TOP_K(1, by=acctbal.DESC()).CALCULATE(supplier_name=name, balance=acctbal)`
Calculate the total value (extended_price * (1 - discount)) for each line item.,`lines.CALCULATE(line_value = extended_price * (1 - discount))`
Calculate the total order value for all orders placed in 1996.,`GRAPH.CALCULATE(total_1996_value = SUM(orders.WHERE(YEAR(order_date)==1996).CALCULATE(value=extended_price*(1-discount)).value))` *Correction*: Need to use pre-calculated total_price if available or calculate line value sum. Assuming `total_price` exists on orders: `GRAPH.CALCULATE(total_1996_value = SUM(orders.WHERE(YEAR(order_date)==1996).total_price))`
Find the average quantity per part.,`parts.WHERE(HAS(lines)==1).CALCULATE(part_key=key, avg_quantity=AVG(lines.quantity))` *Correction*: AVG is aggregation. Global average: `GRAPH.CALCULATE(avg_part_quantity=AVG(parts.lines.quantity))` Average per part: Previous answer is correct structure.
Get the name and phone number of customers whose phone number starts with '25-'.,`customers.CALCULATE(name=name, phone=phone).WHERE(STARTSWITH(phone, '25-'))`
List nations that have at least 10 customers.,`nations.WHERE(COUNT(customers) >= 10).CALCULATE(nation_name=name)`
Find the orderkey and total price for orders placed on or after Jan 1, 1998.,`orders.WHERE(order_date >= DATETIME('1998-01-01')).CALCULATE(order_key=key, total_price=total_price)` Use example format: `orders.WHERE(order_date >= datetime.date(1998, 1, 1)).CALCULATE(order_key=key, total_price=total_price)`
Determine if all customers have a positive account balance.,`GRAPH.CALCULATE(all_positive = HASNOT(customers.WHERE(acctbal <= 0)) == 1)` Alternative: `GRAPH.CALCULATE(min_balance=MIN(customers.acctbal)).CALCULATE(all_positive = min_balance > 0)`
Calculate the age of each customer in years as of today (assuming 'now' gives date). DATEDIFF needed.,`People.CALCULATE(age=DATEDIFF("years", birth_date, DATETIME('now')))`
Find parts where the retail price is more than double the supply cost.,`parts.WHERE(retail_price > (2 * supply_cost))`
List the distinct market segments of customers.,`customers.PARTITION(name="segments", by=mktsegment).CALCULATE(mktsegment)`
Find the rank of each part within its container based on retail price (highest price = rank 1).,`Parts.CALCULATE(rank_in_container=RANKING(by=retail_price.DESC(), per="container"))` *Correction*: `per` needs an ancestor name or omit for global. Assuming partitioning first: `Parts.PARTITION(name="cont", by=container).Parts.CALCULATE(part_key=key, rank_in_container=RANKING(by=retail_price.DESC(), per="cont"))`
Calculate the percentage of the total quantity for each line item relative to its order's total quantity.,`orders.lines.CALCULATE(qty_pct = quantity / RELSUM(quantity, per="orders"))`
Find line items shipped more than 30 days after the order date.,`lines.WHERE(DATEDIFF("days", order.order_date, ship_date) > 30)`
Get the customer name and the number of orders they placed, for customers with more than 20 orders.,`customers.CALCULATE(name=name, order_count=COUNT(orders)).WHERE(order_count > 20)`
Calculate the running total of `total_price` for orders, ordered by `order_date`. (Requires window function not explicitly shown, but conceptually relates to RELSUM/RANKING).,PyDough cheat sheet does not explicitly show a standard `RUNNING_TOTAL` or `CUME_SUM` window function. Could be simulated with complex self-joins or UDFs, but not directly from provided functions. Closest might involve ranking and summing up to rank, but cumbersome. Answer: Not directly supported by shown functions.
Find the most common (mode) `order_priority`.,`orders.PARTITION(name="prios", by=order_priority).CALCULATE(priority=order_priority, count=COUNT(orders)).TOP_K(1, by=count.DESC()).CALCULATE(priority)`
Calculate the difference between the max and min `acctbal` for customers in each nation.,`nations.CALCULATE(nation_name=name, balance_range=MAX(customers.acctbal) - MIN(customers.acctbal))` Requires customers exist: `nations.WHERE(HAS(customers)==1).CALCULATE(...)`
Find suppliers who supply parts of type 'ECONOMY ANODIZED STEEL'.,`suppliers.WHERE(HAS(parts.WHERE(type == 'ECONOMY ANODIZED STEEL')) == 1)`